,id,period,comitee,text,Date,Orator,Applause,ppl,bpc
3116,main1559_1,01/11/1947 - 23/01/1948,ΑΝΑΘΕΩΡΗΤΙΚΗ - ΣΥΝΟΔΟΣ Β' (T.1),"Ὢραν 640’ μ.μ. ὁ Πρόεδρος κ. Ἰω Θ ε ο τ ό κ η ς, ἀνελθὼν ἐπὶ τῆς ἓδρας, κηρύσσει τὴν ἒναρξιν τῆς συνεδριά- σεως καὶ διατάσσει νὰ ἀνοιχθῶσι τὰ θεωρεῖα. Ἀναγιγνώσκονται καὶ ἐπικυροῦνται τὰ πρακτικὰ τῆς προ- ρρυδυης συτδρστω. Ἀνακοινοῦνταε τὰ ἐἱ Τὸ Ἐλεγκτικὸν Συνέδριον ἀνακοινοῖ ὂτι, προέβη εἰς τὴν θεώρησιν τοῦ ὑπ ἀριθ. 564 ἐκ δραχμῶν 1.822.5Ο0 χρήσεως 1941-48 χρηματικοῦ ἐντάλματος τοῦ Ὑπουργείου Εθνικῆς Οἰκονομίας, ἐκδεδομένου ἐπ' ὀνόματι Νικολάου Κάνδια Γραμματέως Α΄ τοῦ Ὑπουργείου Ἐθνικῆς Οἰκο- νομίας, δι' ὁδοιπορικὰ ἒξοδα καὶ ἡμερησίαν αὐτοῦ ἀποζημίω: σιν παραμονῆς του εἰς Ρόδον Δωδεκανήσου. Ὁ Βουλευτὴς κ. Ι. Φ ω τ ό π ο υ λ ο ς, διὰ τηλεγραφή- μαπός του πρὸς τὸ Προεδρεῖον τῆς Βουλῆς, διαμαρτύρεται διὰ τὰ ὑπὸ τοῦ συναδέλφου κ. Γρηγορίου ἀναφερθέντα, κατὰ Ἐθνικοῦ ἢρωος Ταγματάρχου Κρανιᾶ Στόπ. Ἠρωϊκοὶ ὑπέρ Πατρίδος ἀγῶνες Ταγματάρχου Κρανιᾶ καὶ παλληκαριῶν αὐτοῦ ἀξιωματικῶν καὶ ὁπλιτῶν, κατέστησαν τόσον θρυλικοὶ ὢστε ἀναφερθέντα ὑπὸ συναδέλφου δὲν χρήζουν κὰν διαψεύ- σεως Στόπ. Σύμπας Κυνουριακὸς λαός, θεωρῶν ἐαυτὸν ὑβρι- ζόμενον διὰ τῶν ὑπὸ συναδέλφου ἀναφέρομένων καὶ θαυμά- ζων ἂφθαστον πατριωτισμὸν Ἐθνικοῦ ἢρωος Κρανιᾶ, καὶ παλληκαριῶν αὐτοῦ, δηλοῖ ὂτι τίθεται παρὰ τὸ πλευρόν των, αἶνα μετχαὐτῶν ἀγωνισθῇ διὰ πάταξιν παντὸς ἐχθροῦ τῆς Πατρίδος. Ὁ Βουλευτὴς Χαλκιδικῆς κ. Ι. Λαμπρόπουλος, κατα- θέτει ἀναφορὰν τῆς Κοινότητος καὶ τοῦ Γεωργικοῦ Συνέ- ταιρισμοῦ Δουμπλιῶν Χαλκιδικῆς, δι' ἦς αἰτοῦνται ὃπως ἐκ τῆς Λιμνοβάλτης (Καρυγκιόλ) ἐκτάσεως 3.400 στρεμ- μάτων, παραχωρηθῇ ἀνάλογος ἒκτασις εἰς τοὺς ἀκτήμονας τῆς Κοινότητος ταύτης, καθ’ ὃσοννὁ κλῆρος των εἶναι ὁ μι- κρότερος ἐν τῇ περιοχῇ ταύτή. Ὁ Σύλλογος Σημειωτῶν Λιμένος Πατρῶν, διαμαρτύ- ρεται διὰ τὴν μὴ ἀναπροσαρμογὴν συμφώνως πρὸς τὴν σύμ- βασιν ἀπὸ 20-10-4), εἰς τὸ οπλάσιον, Οἱ Ανάπηροι Φυματικοι ὁπλῖται Χωρίῆς 1940-4) ζητοῦν τὴν ὅσον τὸ δυνατὸν ταχυτέραν ψήφισιν τοῦ Νομο- εδίου «περίτροποποιήσεως τοῦ ὁργανισμοῦ Χωρ)κῆςῃ κλπ. Ὁ Λαὸς Μυτιλήνης διαμαρτύρεται διὰ τὰ ὑπὸ τῶν ἀναρ- χικῶν διαπραττόμενα ἐγκλήματα, ἐκφράζει τὸν θαυμασμὸν του πρὸς τὰς Ἐθνειὰς δυνάμεις καὶ λαὸν Κονίτσης καὶ τάστ σεται παρὰ τὸ πλευρὸν τῆς Ἑλληνικῆς Κυβερνήσεως πρὸς πάταξιν τῆς ἀνταρσίας. Ὁ Συλομος Αὐοωηστῶν Ε. Ἐλδὸς ὁ Σψλ- σμος Ἐργατῶν καὶ Ὑπαλλήλων Σπρροελαιοτριβίων καὶ διάφορα ἀλλαὰ Σωματεῖα Θεσψνίκης, διαμαρτύρονται διὰ τὴν μὴ εἰσέτι ἐγκατάστασιν τῆς νομίμου διοικήσεως εἰς τὸ ἐργατικὸν Κέντρον καὶ ζητοῦν ἂμεσον ἐγκατάστασιν ταύτης, Ὁ Σύλλογος Προσωπικοῦ Κυλινδρομύλων καὶ ὁ Συλ- νλοοε ἐγατῶν. Ομοομῶν. Παφρῶν, ἐκφρίζοων τν Απρδος ΣΥΝΕΔΡΙΑΣΙΣ ΛΘ'. Δευτέρα 19 Ἰανουαρίου 1946 κιμασίαν των διὰ τὸν σχηματισμὸν τῆς ψευδοκυβερνήσεωςς τοῦ ἀρχισυμμορίτου Μάρκου. Ὁ κ. Δ. Χ έλ μη ς (Ὑπουργὸς τῶν Οἰκονομικῶν) καταθέτει σχέδιον ψηφίσματος μπερὶ παρατάσεως τοῦ ὁρίου- ἠλικίας τοῦ Προέδρου τοῦ Ἐλεγκτικοῦ Συνεδρίου». Οἱ Βουλευταὶ κ.κ. Α. Δ η μητρᾶ τ ος, Κ. Τσᾶ- τ σ ο ς, Π. Π α π α λ η γ ο ύ ρ α ς, Φ. Μ ακρῆ ς, Ε. Κος- μνη νός, Κ. Ο ἱ κ ο ν ο μί δη ς, Ν. Βαρβι τσι ώ- της,Γ. Κασι μά τη ς Ε. Γ ο νῆ ς, Ι. Μ πουρ νι 6, κ. ἀ, καταθέτουσι πρότασιν νόμου «περὶ μετονομασίας τῆς Βαλλιανείου Σχολῆς Ληξουρίου τῶν τίτλων αὐτῆς καὶ τρο- ποποιήσεως καὶ συμπληρώσεως τῶν ὑπ ἀριθ. 2194ψ43- 95)46 καὶ 586011938 Νομοθ. Διαταγμάτωνν. Ἡ ἐ πὶ ςῶν Ἐ ξ ωτ ε ρ : κ ὢῶ ν Κ ο ι ν ο β ου λευ τίς κὴ Ἐ πι τ ρ ο πὴ καταθέτει τὰς ἐκθέσεις τῆς ἐπὶ τῶν σχε- δίων νόμων 1) μπερὶ κυρώσεως τῆς δι' ἀνταλλαγῆς ἐπιστο. λῶν ἐπελθούσης μεταξὺ Ἑλλάδος καὶ Ἐλβετίας συμφω- νίας περὶ παραχωρήσεως τῆς ρήτρας τοῦ μᾶλλον εὐνοουμέτη νου κράτουςν 2) μπερὶ κυρώσεως τῆς ἀπὸ 14 Ἰανουχρίου 1946 συμφωνίας «περὶ συστάσεως Εὐρωπαϊκοῦ Ὀργανι- νισμοῦ ζἈνθρακοςυ, 3) ὑπερὶ κυρώσεως τῆς Διεθνοὺς συμ- φωνίας διὰ τὴν διατήρησιν ἡ ἀποκατάστασιν τῶν δικαιω- μάτων τῆς βιομηχανιμῆς ἰδιοκτησίας τῆς πληγείσης ὑπὸ τοῦ δευτέρου παγκρσμίου πολέμου» 4) απερὶ κυρωσεως τῆς ἐν Ἀθήναις μεταξὺ Ἑλλάδος καὶ Γαλλίας ὑπογραφείσης τῇ 5 Μαΐου 194) συμφωνίας (περὶ ἐναερίων μεταφορῶνυ. 5) περὶ κυρώσεως τῆς Διεθνοῦς Ὑγειονομικῆς Συμβάσεως) τοῦ 1944 τροποποιούσης τὴν Διεθνῇ Ὑγειονομικὴν Σύμ- βασιν τῆς Αεροναυτιλίας τῆς 12 Ἀπριλίου 1933υ καὶ 6) μπερὶ ἀπονομῆς τοῦ βαθμοῦ τοῦ Ὑποστρατήγου εἰς Ἀνω- τάτους Ὑπαλλήλους Ὑπουργείου Ἐξωτερικῶνυ. Ἡ ἐπὶ π ῶν Θ ρ η σ κ ευ μά τιων καὶ Ἒθνι- κ ῆ ς Π α ι δ ε ί α ς Κ ο ι ν ο β ουλ έ μτι κὴ Ἐ πι τ ρ ος πὴ, καταθέτει τὴν ἐκθεσίν τῆς ἐπὶ τοῦ σχεδίου νόμου μπερί ᾳ ἐγκρίσεως τῶν κατὰ τὰ πρὸ ποῦ 194λ-48 οἰκονομικὰ ἒτη (ήτοι 1944-45, Θ' περιόδου, 1945-46 καὶ 1946-4Τ)Ρ πραγματοποιηθεισῶν δαπανῶν τῆς ἀρμοδιότητος τοῦ Ὑπουρ- γείου Θρησκευμάτων καὶ Ἐθνικῆς Παιδείας καὶ τῆς ἐγγρατὴ- φῆς τῶν διὰ τὴν πληρωμὴν αὐτῶν ἀπαιτουμένων πιστώσεωνῇ εἰς τὸν προϋπολογισμὸν ἐξόδων τοῦ ὁἰκονομικοῦ ἒτους ; 194λ-48υ. 61 8 ουλ εύ τα )κν κ. Μ. Βλ ι ά μ ος Ι. Σα ραν- τάκη ς, Κ. Ζ ου μ π ου λ ά κ η ς, Μ. Βαρβιτστώ- τῆς, Χ. Σ τ ε ρ γ ι ό π ο υ λ ο ς, Δ. Β ο υ ρ δ ο υ μ πᾶς, Ι. Μπουρνιᾶς κ. ἀ καταθέτουσι τροπολογίαν ἐπὶ τοῦ σχεδίου νόμου μπερὶ τακτοποιήσεως τῆς θέσεως, τῶν Ἀ- ξιωματικῶν κὰὶ Ἀνθυπασπιστῶν Χωροφυλακῆς , τῶν τε- Λούντων εἰς, τὴν κατηγορίαν τῶν ἐκτὸς ὑπηρεσίας καὶ Ὁρ. γανικῶν θέσεων». ",Δευτέρα 19 Ἰανουαρίου 1946,"Θ ε ο τ ό κ η ,η ",,7.970063999644914,2.9945913091090497
